{
  "$schema": "https://json-schema.org/draft/2020-12/schema",
  "$id": "https://schemas.codestra.dev/document-intelligence/v1/client-intake.schema.json",
  "title": "Minimal reviewed identity projection for client intake",
  "description": "Contract version 1.0.0. See architecture and privacy requirements in the package documentation.",
  "type": "object",
  "properties": {
    "scan_id": {
      "$ref": "#/$defs/id"
    },
    "tenant_id": {
      "$ref": "#/$defs/id"
    },
    "schema_version": {
      "const": "1.0.0"
    },
    "country": {
      "const": "DO"
    },
    "document_type": {
      "const": "driver_license"
    },
    "document_hash": {
      "$ref": "#/$defs/documentHash"
    },
    "document_hash_key_id": {
      "$ref": "#/$defs/id"
    },
    "document_last4": {
      "$ref": "#/$defs/last4"
    },
    "full_name": {
      "type": "string",
      "minLength": 1,
      "maxLength": 200,
      "pattern": "\\S"
    },
    "birth_date": {
      "anyOf": [
        {
          "$ref": "#/$defs/date"
        },
        {
          "type": "null"
        }
      ]
    },
    "address": {
      "anyOf": [
        {
          "type": "string",
          "minLength": 1,
          "maxLength": 500,
          "pattern": "\\S"
        },
        {
          "type": "null"
        }
      ]
    },
    "reviewed_at": {
      "$ref": "#/$defs/timestamp"
    }
  },
  "required": [
    "scan_id",
    "tenant_id",
    "schema_version",
    "country",
    "document_type",
    "document_hash",
    "document_hash_key_id",
    "document_last4",
    "full_name",
    "reviewed_at"
  ],
  "additionalProperties": false,
  "$defs": {
    "date": {
      "type": "string",
      "format": "date",
      "minLength": 10,
      "maxLength": 10,
      "pattern": "^[0-9]{4}-[0-9]{2}-[0-9]{2}$"
    },
    "documentHash": {
      "type": "string",
      "minLength": 1,
      "maxLength": 76,
      "pattern": "^hmac-sha256:[0-9a-f]{64}$"
    },
    "id": {
      "type": "string",
      "minLength": 1,
      "maxLength": 128,
      "pattern": "^[A-Za-z0-9][A-Za-z0-9._:-]{0,127}$"
    },
    "last4": {
      "type": "string",
      "minLength": 1,
      "maxLength": 4,
      "pattern": "^[0-9]{4}$"
    },
    "timestamp": {
      "type": "string",
      "format": "date-time",
      "maxLength": 40,
      "pattern": "^\\d{4}-\\d{2}-\\d{2}T\\d{2}:\\d{2}:\\d{2}(?:\\.\\d{1,6})?Z$"
    }
  }
}
