{
  "scan_id": "scan-synthetic-001",
  "tenant_id": "tenant-example",
  "schema_version": "1.0.0",
  "country": "DO",
  "document_type": "driver_license",
  "document_hash": "hmac-sha256:bbbbbbbbbbbbbbbbbbbbbbbbbbbbbbbbbbbbbbbbbbbbbbbbbbbbbbbbbbbbbbbb",
  "document_hash_key_id": "synthetic-key-v1",
  "document_last4": "0000",
  "full_name": "PERSONA SINTETICA EJEMPLO",
  "reviewed_at": "2026-09-25T12:00:00Z",
  "birth_date": null,
  "address": null
}
